{
    "workspace_name": "Test Workspace",
    "environment": "testing",
    "storage": {
        "mode": "local",
        "local": {
            "base_path": "${user_documents}/mediaplanpy_test",
            "create_if_missing": true
        }
    },
    "database": {
        "enabled": false
    },
    "google_sheets": {
        "enabled": false
    },
    "logging": {
        "level": "DEBUG"
    }
}